戦略ID,戦略名,説明,none_0,n1_d0_g0,n1_d0_g1,n1_d1_g0,n2_d0_g0,n2_d0_g1,n2_d0_g2,n2_d0_g12,n2_d1_g0,n2_d1_g2,n2_d2_g0,n2_d2_g1,n3_d0_g0,n3_d0_g1,n3_d0_g2,n3_d0_g3,n3_d0_g12,n3_d0_g13,n3_d0_g23,n3_d0_g123,n3_d1_g0,n3_d1_g2,n3_d1_g3,n3_d1_g23,n3_d2_g0,n3_d2_g1,n3_d2_g3,n3_d2_g13,n3_d3_g0,n3_d3_g1,n3_d3_g2,n3_d3_g12
no_lure,Lなし,ルアーアクションを一切行わずキャスト後そのまま待機,1,0,0,0,0,0,0,0,0,0,0,0,0,0,0,0,0,0,0,0,0,0,0,0,0,0,0,0,0,0,0,0
fixed_l2,L2固定,状況に関わらず必ず2回使用して待機,0,0,0,0,1,1,1,1,1,1,1,1,0,0,0,0,0,0,0,0,0,0,0,0,0,0,0,0,0,0,0,0
fixed_l3,L3固定,状況に関わらず必ず3回使用して待機,0,0,0,0,0,0,0,0,0,0,0,0,1,1,1,1,1,1,1,1,1,1,1,1,1,1,1,1,1,1,1,1
b2_disc_push,発見延長優先(基本2回),何もなければ2回で待機、未発見で型確定したらそのまま待機、発見済なら型確定しても3回まで使用,0,0,1,0,1,0,1,0,0,0,0,0,0,0,0,0,0,0,0,0,1,1,1,1,1,0,1,0,0,0,0,0
b2_guar_stop,型確定停止優先(基本2回),何もなければ2回で待機、発見済なら3回まで使用するが、型確定したらそこで待機,0,0,1,0,1,0,1,0,0,1,0,0,0,0,0,0,0,0,0,0,1,0,1,0,1,0,1,0,0,0,0,0
b3_guar_stop,型確定停止（基本３回）,何もなければ３回で待機、型確定したらそこで待機,0,0,1,0,0,0,1,0,0,1,0,0,1,0,0,1,0,0,0,0,1,0,1,0,1,0,1,0,1,0,0,0